{
  "$schema": "https://json-schema.org/draft/2020-12/schema",
  "$id": "https://nx-codex.local/schemas/nxopen-api-contract.schema.json",
  "title": "NX Codex Required NXOpen API Contract",
  "type": "object",
  "additionalProperties": false,
  "required": [
    "schemaVersion",
    "contractId",
    "adapterId",
    "assemblies",
    "requiredTypes",
    "requiredMembers",
    "forbiddenMembers"
  ],
  "properties": {
    "schemaVersion": { "const": "1.0" },
    "contractId": { "type": "string", "minLength": 1 },
    "adapterId": { "type": "string", "minLength": 1 },
    "assemblies": {
      "type": "array",
      "minItems": 1,
      "items": {
        "type": "object",
        "additionalProperties": false,
        "required": ["name", "assemblyVersion"],
        "properties": {
          "name": { "type": "string", "minLength": 1 },
          "assemblyVersion": { "type": "string", "minLength": 1 }
        }
      }
    },
    "requiredTypes": {
      "type": "array",
      "uniqueItems": true,
      "items": { "type": "string", "minLength": 1 }
    },
    "requiredMembers": {
      "type": "array",
      "uniqueItems": true,
      "items": { "type": "string", "minLength": 1 }
    },
    "forbiddenMembers": {
      "type": "array",
      "uniqueItems": true,
      "items": { "type": "string", "minLength": 1 }
    }
  }
}
