{
  "schemaVersion": "1.0",
  "contractId": "nx12.0.2.9-required-api-v1",
  "adapterId": "nx12.0.2.9",
  "assemblies": [
    { "name": "NXOpen", "assemblyVersion": "12.0.2.9" },
    { "name": "NXOpen.UF", "assemblyVersion": "12.0.2.9" },
    { "name": "NXOpen.Utilities", "assemblyVersion": "12.0.2.9" }
  ],
  "requiredTypes": [
    "NXOpen.BasePart",
    "NXOpen.Assemblies.Component",
    "NXOpen.Assemblies.ComponentAssembly",
    "NXOpen.Body",
    "NXOpen.Builder",
    "NXOpen.CoordinateSystemCollection",
    "NXOpen.CurveCollection",
    "NXOpen.DexManager",
    "NXOpen.Drawings.BaseView",
    "NXOpen.Drawings.BaseViewBuilder",
    "NXOpen.Drawings.DraftingDrawingSheet",
    "NXOpen.Drawings.DraftingDrawingSheetCollection",
    "NXOpen.Drawings.DraftingView",
    "NXOpen.Drawings.DraftingViewCollection",
    "NXOpen.Drawings.DrawingSheet",
    "NXOpen.Drawings.DrawingSheetCollection",
    "NXOpen.Drawings.SelectModelViewBuilder",
    "NXOpen.Drawings.ViewPlacementBuilder",
    "NXOpen.Drawings.ViewScaleBuilder",
    "NXOpen.Edge",
    "NXOpen.Features.ExtrudeBuilder",
    "NXOpen.Features.Feature",
    "NXOpen.Features.FeatureCollection",
    "NXOpen.Line",
    "NXOpen.LicenseManager",
    "NXOpen.ModelingView",
    "NXOpen.ModelingViewCollection",
    "NXOpen.NXObject",
    "NXOpen.Part",
    "NXOpen.PartCollection",
    "NXOpen.PartLoadStatus",
    "NXOpen.PartSaveStatus",
    "NXOpen.PlaneCollection",
    "NXOpen.SectionCollection",
    "NXOpen.SelectNXObject",
    "NXOpen.Session",
    "NXOpen.SketchCollection",
    "NXOpen.SketchInPlaceBuilder",
    "NXOpen.StepCreator",
    "NXOpen.Tag",
    "NXOpen.TaggedObject",
    "NXOpen.UF.UFAssem",
    "NXOpen.UF.UFCsys",
    "NXOpen.UF.UFDisp",
    "NXOpen.UF.UFModl",
    "NXOpen.UF.UFPart",
    "NXOpen.UF.UFSession",
    "NXOpen.View"
  ],
  "requiredMembers": [
    "method|NXOpen.BasePart|Close(NXOpen.BasePart+CloseWholeTree,NXOpen.BasePart+CloseModified,NXOpen.PartCloseResponses)->System.Void",
    "method|NXOpen.BasePart|SaveAs(System.String)->NXOpen.PartSaveStatus",
    "method|NXOpen.Assemblies.Component|GetChildren()->NXOpen.Assemblies.Component[]",
    "method|NXOpen.Assemblies.Component|GetComponentRepresentationMode()->NXOpen.Assemblies.Component+RepresentationMode",
    "method|NXOpen.Body|GetEdges()->NXOpen.Edge[]",
    "method|NXOpen.Body|GetFaces()->NXOpen.Face[]",
    "method|NXOpen.Body|GetFeatures()->NXOpen.Features.Feature[]",
    "method|NXOpen.Builder|Commit()->NXOpen.NXObject",
    "method|NXOpen.Builder|Destroy()->System.Void",
    "method|NXOpen.CoordinateSystemCollection|CreateCoordinateSystem(NXOpen.Point3d,NXOpen.Matrix3x3,System.Boolean)->NXOpen.CartesianCoordinateSystem",
    "method|NXOpen.CurveCollection|CreateLine(NXOpen.Point3d,NXOpen.Point3d)->NXOpen.Line",
    "method|NXOpen.DexManager|CreateStepCreator()->NXOpen.StepCreator",
    "method|NXOpen.Drawings.DraftingDrawingSheetCollection|InsertSheet(System.String,NXOpen.Drawings.DrawingSheet+Unit,System.Double,System.Double,System.Double,System.Double,NXOpen.Drawings.DrawingSheet+ProjectionAngleType)->NXOpen.Drawings.DraftingDrawingSheet",
    "method|NXOpen.Drawings.DraftingDrawingSheetCollection|ToArray()->NXOpen.Drawings.DraftingDrawingSheet[]",
    "method|NXOpen.Drawings.DraftingViewCollection|CreateBaseViewBuilder(NXOpen.Drawings.BaseView)->NXOpen.Drawings.BaseViewBuilder",
    "method|NXOpen.Drawings.DraftingViewCollection|ToArray()->NXOpen.Drawings.DraftingView[]",
    "method|NXOpen.Drawings.DrawingSheet|GetDraftingViews()->NXOpen.Drawings.DraftingView[]",
    "method|NXOpen.Drawings.DrawingSheet|GetScale(out System.Double&,out System.Double&)->System.Void",
    "method|NXOpen.Drawings.DrawingSheetCollection|ToArray()->NXOpen.Drawings.DrawingSheet[]",
    "method|NXOpen.Edge|GetVertices(out NXOpen.Point3d&,out NXOpen.Point3d&)->System.Void",
    "method|NXOpen.Features.FeatureCollection|CreateExtrudeBuilder(NXOpen.Features.Feature)->NXOpen.Features.ExtrudeBuilder",
    "method|NXOpen.Features.Feature|GetParents()->NXOpen.Features.Feature[]",
    "method|NXOpen.LicenseManager|GetActiveLicensesInABundle(System.String)->System.String[]",
    "method|NXOpen.LicenseManager|GetBundlesUsed()->System.String[]",
    "method|NXOpen.ModelingViewCollection|ToArray()->NXOpen.ModelingView[]",
    "method|NXOpen.PartCollection|NewDisplay(System.String,NXOpen.Part+Units)->NXOpen.Part",
    "method|NXOpen.PartCollection|OpenDisplay(System.String,out NXOpen.PartLoadStatus&)->NXOpen.Part",
    "method|NXOpen.PlaneCollection|CreatePlane(NXOpen.Point3d,NXOpen.Vector3d,NXOpen.SmartObject+UpdateOption)->NXOpen.Plane",
    "method|NXOpen.SectionCollection|CreateSection(System.Double,System.Double,System.Double)->NXOpen.Section",
    "method|NXOpen.SelectNXObject|SetValue(NXOpen.NXObject,NXOpen.View,NXOpen.Point3d)->System.Void",
    "method|NXOpen.SketchCollection|CreateSketchInPlaceBuilder2(NXOpen.Sketch)->NXOpen.SketchInPlaceBuilder",
    "method|NXOpen.UF.UFCsys|MapPoint(System.Int32,System.Double[],System.Int32,out System.Double[])->System.Void",
    "method|NXOpen.UF.UFAssem|AskComponentData(NXOpen.Tag,out System.String&,out System.String&,out System.String&,out System.Double[],out System.Double[],out System.Double[,])->System.Void",
    "method|NXOpen.UF.UFDisp|CreateImage(System.String,NXOpen.UF.UFDisp+ImageFormat,NXOpen.UF.UFDisp+BackgroundColor)->System.Void",
    "method|NXOpen.UF.UFModl|AskBoundingBoxExact(NXOpen.Tag,NXOpen.Tag,out System.Double[],out System.Double[,],out System.Double[])->System.Void",
    "method|NXOpen.UF.UFModl|AskFaceData(NXOpen.Tag,out System.Int32&,out System.Double[],out System.Double[],out System.Double[],out System.Double&,out System.Double&,out System.Int32&)->System.Void",
    "method|NXOpen.UF.UFModl|AskMassProps3d(NXOpen.Tag[],System.Int32,System.Int32,System.Int32,System.Double,System.Int32,System.Double[],out System.Double[],out System.Double[])->System.Void",
    "method|NXOpen.UF.UFModl|AskPointContainment(System.Double[],NXOpen.Tag,out System.Int32&)->System.Void",
    "method|NXOpen.UF.UFModl|CreateBlend(System.String,NXOpen.Tag[],System.Int32,System.Int32,System.Int32,System.Double,out NXOpen.Tag&)->System.Void",
    "method|NXOpen.UF.UFModl|CreateRevolved(NXOpen.Tag[],out System.String[],System.Double[],System.Double[],NXOpen.UF.FeatureSigns,out NXOpen.Tag[]&)->System.Void",
    "method|NXOpen.UF.UFModl|CreateSimpleHole(System.Double[],System.Double[],System.String,System.String,System.String,NXOpen.Tag,NXOpen.Tag,out NXOpen.Tag&)->System.Void",
    "method|NXOpen.UF.UFModl|IntersectBodies(NXOpen.Tag,NXOpen.Tag,out System.Int32&,out NXOpen.Tag[]&)->System.Void",
    "method|NXOpen.UF.UFModl|SubtractBodies(NXOpen.Tag,NXOpen.Tag,out System.Int32&,out NXOpen.Tag[]&)->System.Void",
    "method|NXOpen.UF.UFModl|UniteBodies(NXOpen.Tag,NXOpen.Tag)->System.Void",
    "method|NXOpen.UF.UFPart|IsModified(NXOpen.Tag)->System.Boolean",
    "method|NXOpen.UF.UFPart|IsLoaded(System.String)->System.Int32",
    "property|NXOpen.Assemblies.Component|DisplayName():System.String",
    "property|NXOpen.Assemblies.Component|IsSuppressed():System.Boolean",
    "property|NXOpen.Assemblies.ComponentAssembly|RootComponent():NXOpen.Assemblies.Component",
    "property|NXOpen.BasePart|ComponentAssembly():NXOpen.Assemblies.ComponentAssembly",
    "property|NXOpen.BasePart|FullPath():System.String",
    "property|NXOpen.BasePart|Leaf():System.String",
    "property|NXOpen.BasePart|ModelingViews():NXOpen.ModelingViewCollection",
    "property|NXOpen.BasePart|PartUnits():NXOpen.BasePart+Units",
    "property|NXOpen.Drawings.BaseViewBuilder|Placement():NXOpen.Drawings.ViewPlacementBuilder",
    "property|NXOpen.Drawings.BaseViewBuilder|Scale():NXOpen.Drawings.ViewScaleBuilder",
    "property|NXOpen.Drawings.BaseViewBuilder|SelectModelView():NXOpen.Drawings.SelectModelViewBuilder",
    "property|NXOpen.Drawings.SelectModelViewBuilder|SelectedView():NXOpen.ModelingView",
    "property|NXOpen.Drawings.ViewPlacementBuilder|Placement():NXOpen.SelectNXObject",
    "property|NXOpen.Drawings.ViewScaleBuilder|Denominator():System.Double",
    "property|NXOpen.Drawings.ViewScaleBuilder|Numerator():System.Double",
    "property|NXOpen.Drawings.ViewScaleBuilder|ScaleType():NXOpen.Drawings.ViewScaleBuilder+Type",
    "property|NXOpen.Edge|SolidEdgeType():NXOpen.Edge+EdgeType",
    "property|NXOpen.Features.ExtrudeBuilder|Section():NXOpen.Section",
    "property|NXOpen.Features.Feature|FeatureType():System.String",
    "property|NXOpen.Features.Feature|Suppressed():System.Boolean",
    "property|NXOpen.Features.Feature|Timestamp():System.Int32",
    "property|NXOpen.Line|EndPoint():NXOpen.Point3d",
    "property|NXOpen.Line|StartPoint():NXOpen.Point3d",
    "property|NXOpen.NXObject|JournalIdentifier():System.String",
    "property|NXOpen.NXObject|Name():System.String",
    "property|NXOpen.ModelingViewCollection|WorkView():NXOpen.ModelingView",
    "property|NXOpen.Part|DraftingDrawingSheets():NXOpen.Drawings.DraftingDrawingSheetCollection",
    "property|NXOpen.Part|DraftingViews():NXOpen.Drawings.DraftingViewCollection",
    "property|NXOpen.Part|DrawingSheets():NXOpen.Drawings.DrawingSheetCollection",
    "property|NXOpen.PartLoadStatus|NumberUnloadedParts():System.Int32",
    "property|NXOpen.PartSaveStatus|NumberUnsavedObjects():System.Int32",
    "property|NXOpen.PartSaveStatus|NumberUnsavedParts():System.Int32",
    "property|NXOpen.Session|ApplicationName():System.String",
    "property|NXOpen.Session|LicenseManager():NXOpen.LicenseManager",
    "property|NXOpen.SketchInPlaceBuilder|Csystem():NXOpen.CartesianCoordinateSystem",
    "property|NXOpen.SketchInPlaceBuilder|PlaneReference():NXOpen.Plane",
    "property|NXOpen.StepCreator|ExportAs():NXOpen.StepCreator+ExportAsOption",
    "property|NXOpen.StepCreator|ExportFrom():NXOpen.StepCreator+ExportFromOption",
    "property|NXOpen.StepCreator|ExportSolidsAndSurfacesAs():NXOpen.StepCreator+ExportSolidsAndSurfacesAsOption",